vin,make,model,year,trim,mileage,story_name,story_description,expected_market_price,expected_recon_cost,expected_offer,expected_outcome
1HGBH41JXMN109186,Honda,Accord,2022,EX-L,32000,The Winner,Clean vehicle with aftermarket wheels detected by AI - won trade against CarMax,26000,400,24500,"Vision AI detects +$800 value from aftermarket wheels, minor scratches require $400 recon. Strong offer wins trade."
5YJYGDEF2NF123456,Tesla,Model Y,2022,Performance,28500,The Loss,Front collision damage that static tools miss - major recon needed,52000,3500,46500,"Shows how vision AI catches severe damage. High recon cost requires conservative offer to protect margins."
1FTFW1ET5DFC10234,Ford,F-150,2019,Lariat,65000,Geo-Arbitrage,Popular truck worth $2K more in Texas than Florida,32000,600,29500,"Regional analysis shows higher demand in Southwest. Could offer more and still profit."
WBAJE5C50HWY01234,BMW,3 Series,2020,330i,45000,High Recon,Heavy damage requiring paint and interior work,28000,2500,24200,"Vision AI detects multiple issues: paint fade, seat tears, dent. High recon cost requires conservative offer."
2T1BURHE0JC123456,Toyota,Camry,2023,XSE,18000,Fast Mover,Low mileage popular trim - high demand vehicle,29000,200,27800,"Market analysis shows this trim sells in 12 days avg. Can offer aggressively and still profit quickly."
1HGCY1F56RA100001,Honda,Accord,2024,Sport,12000,New Tech,Nearly new 2024 with latest safety tech and low mileage - premium vehicle,32500,150,30800,"Latest model year with Honda Sensing 360. Vision AI confirms excellent condition. Strong demand for new tech features."
1HGCV1F43PA000456,Honda,Accord Hybrid,2023,Sport,19459,Pristine Hybrid,Nearly new hybrid with aftermarket upgrades and exceptional condition,33500,0,31800,"Excellent condition hybrid with window tint and sporty upgrades. Vision AI confirms showroom quality. Zero reconditioning needed."
